[
 {
  "gold_id": "BERK-ALG-01",
  "jurisdiction": "Berkeley, CA",
  "level": "city",
  "category": "algorithmic_rent_setting",
  "status": "in_force",
  "title": "Prohibition on coordinated pricing algorithms – BMC ch. 13.63 (Ord. 7992-NS)",
  "requirement": "It is unlawful to sell or provide to Berkeley landlords, or for a landlord to use, a coordinated pricing algorithm that uses nonpublic competitor data to set or recommend rents or occupancy levels; each unit and month is a separate violation (up to $1,000 each).",
  "key_value": "ban on sale/use of coordinated pricing algorithms",
  "coverage": {
   "coo_cutoff": null,
   "year_built_max": null,
   "min_units": null,
   "max_units": null,
   "owner_type": null,
   "tenancy_months": null,
   "other": "All residential dwelling units in the City of Berkeley"
  },
  "exemptions": "Aggregated anonymous reports; affordable-housing rent-limit tools; market research, appraisal and software testing uses",
  "effective_date": "2026-01-01",
  "enacted_date": "2025-12-02",
  "sunset_date": null,
  "citation": "Berkeley Mun. Code § 13.63.030 (Ord. 7992-NS)",
  "source_ids": [
   "S-BK-08",
   "S-BK-09"
  ],
  "corpus_doc_ids": [
   "D001"
  ],
  "supplementary_doc_ids": [
   "D002"
  ],
  "quoted_span": "B. It shall be unlawful for a landlord to use a coordinated pricing algorithm described \nin subsection A when setting rents or occupancy levels for residential dwelling units in \nthe City of Berkeley.",
  "quoted_span_in_corpus": true,
  "quote_verified": true,
  "interaction": {
   "overrides": [],
   "yields_to": [],
   "note": "Additional to state AB 325 (CA-ALG-01)"
  },
  "conflict_flag": true,
  "conflict_note": "Organisers' README: two published effective dates — 2026-03-01 (ordinance text) vs January 2026 (Aug-2026 law-firm alert). Verified history: Ord. 7956-NS added ch. 13.63 (adopted 2025-03-25, eff. 2025-04-24); Ord. 7974-NS (adopted 2025-07-08, eff. 2025-08-07) inserted \"The provisions of this Chapter shall not take effect until March 1, 2026\"; Ord. 7992-NS (adopted 2025-12-02, eff. 2026-01-01 per berkeley.municipal.codes) re-enacted the chapter without that clause. Decided by Hamza 2026-10-04 (Q1): effective_date 2026-01-01; conflict_flag retained (organisers' open question).",
  "negative_finding": false,
  "negative_reason": null,
  "confidence": 0.7,
  "verified_against": [
   {
    "url": "https://berkeleyca.gov/sites/default/files/documents/2025-12-02%20Item%2001%20Ordinance%207992.pdf",
    "checked_at_utc": "2026-10-01T22:44Z",
    "result": "organisers corpus copy D001 (official): Ord. 7,992-N.S. text, passed to print 2025-11-18"
   },
   {
    "url": "https://berkeley.municipal.codes/enactments/Ord7992-NS",
    "checked_at_utc": "2026-10-03T20:12Z",
    "result": "official code publisher: adopted December 2, 2025; effective January 1, 2026"
   },
   {
    "url": "https://berkeleyca.gov/sites/default/files/documents/2025-07-08%20Item%2001%20Amendments%20to%20Ordinance%20Prohibiting.pdf",
    "checked_at_utc": "2026-10-03T20:13Z",
    "result": "official council item for Ord. 7974-NS: \"The provisions of this Chapter shall not take effect until March 1, 2026.\""
   },
   {
    "url": "https://morganlewis.com/pubs/2026/08/algorithmic-rent-pricing-litigation-expands-under-new-state-and-local-laws",
    "checked_at_utc": "2026-10-03T18:49Z",
    "result": "team supplementary D002 (secondary): \"Berkeley Mun. Code ch. 13.63 (effective January 2026)\""
   }
  ],
  "verifier": "AI-draft",
  "notes": "RealPage v. City of Berkeley (N.D. Cal.) voluntarily dismissed with prejudice 2026-01-14 per D002."
 },
 {
  "gold_id": "BERK-DEP-01",
  "jurisdiction": "Berkeley, CA",
  "level": "city",
  "category": "security_deposits",
  "status": "in_force",
  "title": "Interest on security deposits – Berkeley Rent Ordinance (BMC § 13.76.070)",
  "requirement": "Landlords of units fully or partially covered by the Rent Ordinance must pay tenants interest on security deposits at the end of each year (prorated on move-out).",
  "key_value": "annual interest on deposits (covered units)",
  "coverage": {
   "coo_cutoff": null,
   "year_built_max": null,
   "min_units": null,
   "max_units": null,
   "owner_type": null,
   "tenancy_months": null,
   "other": "Units fully or partially covered by the Rent Ordinance"
  },
  "exemptions": "Exempt units (see BERK-JUST-01)",
  "effective_date": null,
  "enacted_date": null,
  "sunset_date": null,
  "citation": "Berkeley Mun. Code § 13.76.070",
  "source_ids": [
   "S-BK-04",
   "S-BK-02"
  ],
  "corpus_doc_ids": [
   "D007",
   "D009"
  ],
  "supplementary_doc_ids": [],
  "quoted_span": "landlords must pay tenants interest on their security deposit at the end of each year and a prorated amount if the tenant moves out before the end of the year.",
  "quoted_span_in_corpus": true,
  "quote_verified": true,
  "interaction": {
   "overrides": [],
   "yields_to": [],
   "note": "Adds to the state one-month cap (CA-DEP-01)"
  },
  "conflict_flag": false,
  "conflict_note": null,
  "negative_finding": false,
  "negative_reason": null,
  "confidence": 0.75,
  "verified_against": [
   {
    "url": "https://rentboard.berkeleyca.gov/rights-responsibilities/security-deposits",
    "checked_at_utc": "2026-10-01T22:35Z",
    "result": "organisers corpus copy D007 (official Rent Board)"
   },
   {
    "url": "https://rentboard.berkeleyca.gov/sites/default/files/documents/Rent%20Ordinance%20Coverage%20by%20Unit%20Type.pdf",
    "checked_at_utc": "2026-10-01T22:35Z",
    "result": "organisers corpus copy D009: security deposit interest column"
   }
  ],
  "verifier": "AI-draft",
  "notes": "Section number 13.76.070 from general knowledge – Hamza to confirm. Category fit (interest duty) flagged like LA-DEP-01/SF-DEP-01."
 },
 {
  "gold_id": "BERK-FEE-01",
  "jurisdiction": "Berkeley, CA",
  "level": "city",
  "category": "application_screening_fees",
  "status": "in_force",
  "title": "Tenant screening fee disclosure and renewal-fee ban – BMC ch. 13.78",
  "requirement": "An owner charging a screening fee must give the applicant a clear tenant-screening-fee rights statement and state the maximum fee permitted under Cal. Civ. Code § 1950.6(b) (BMC 13.78.010); non-refundable fees to existing tenants for renewals or roommate changes are prohibited (BMC 13.78.016).",
  "key_value": "disclosure of state fee cap required; no non-refundable renewal/roommate fees",
  "coverage": {
   "coo_cutoff": null,
   "year_built_max": null,
   "min_units": null,
   "max_units": null,
   "owner_type": null,
   "tenancy_months": null,
   "other": "All residential rental agreements in Berkeley"
  },
  "exemptions": null,
  "effective_date": null,
  "enacted_date": null,
  "sunset_date": null,
  "citation": "Berkeley Mun. Code §§ 13.78.010, 13.78.016",
  "source_ids": [
   "S-BK-05"
  ],
  "corpus_doc_ids": [
   "D005"
  ],
  "supplementary_doc_ids": [],
  "quoted_span": "cannot charge a non-refundable fee to any existing tenant for the purpose of renewing a tenancy, in whole or in part, including any fee associated with the departure of a roommate or to request to add or replace a roommate in a pre-existing household.",
  "quoted_span_in_corpus": true,
  "quote_verified": true,
  "interaction": {
   "overrides": [],
   "yields_to": [],
   "note": "Does not change the state cap (CA-FEE-01); both apply"
  },
  "conflict_flag": true,
  "conflict_note": "Borderline categorisation: BMC 13.78 is a disclosure/notice duty plus a renewal-fee ban, not a fee cap. Alternative is a negative finding (BERK-FEE-00) with the state cap governing. Decision reserved for Hamza (open_questions.md).",
  "negative_finding": false,
  "negative_reason": null,
  "confidence": 0.6,
  "verified_against": [
   {
    "url": "https://rentboard.berkeleyca.gov/laws-regulations/city-berkeley-ordinances-affecting-rental-properties/tenant-screening-and",
    "checked_at_utc": "2026-10-01T22:35Z",
    "result": "organisers corpus copy D005 (official Rent Board): BMC 13.78.010/.016/.018; 2026 maximum screening fee $68.96"
   }
  ],
  "verifier": "AI-draft",
  "notes": "effective_date null (ordinance date not verified). The Rent Board page publishes a 2026 maximum screening fee of $68.96 – a local computation of the state CPI-adjusted cap."
 },
 {
  "gold_id": "BERK-JUST-01",
  "jurisdiction": "Berkeley, CA",
  "level": "city",
  "category": "just_cause_eviction",
  "status": "in_force",
  "title": "Rent Stabilization and Eviction for Just Cause Ordinance – BMC § 13.76.130",
  "requirement": "Tenants in fully or partially covered units may be evicted only for a just cause listed in the ordinance; Measure BB (2024) bars non-payment evictions for debt under one month of HUD Fair Market Rent and removed the failure-to-sign-a-new-lease ground.",
  "key_value": "enumerated just causes; non-payment eviction only if debt ≥ 1 month FMR",
  "coverage": {
   "coo_cutoff": null,
   "year_built_max": null,
   "min_units": null,
   "max_units": null,
   "owner_type": null,
   "tenancy_months": null,
   "other": "All units fully or partially covered by the Rent Ordinance (including new construction and single-family homes)"
  },
  "exemptions": "Exempt units: golden duplex; owner-shared kitchen/bath where owner lived there first; owner-occupied ADU properties (tenancies after 2018-11-07); dormitories; nonprofit cooperatives",
  "effective_date": null,
  "enacted_date": null,
  "sunset_date": null,
  "citation": "Berkeley Mun. Code § 13.76.130",
  "source_ids": [
   "S-BK-02",
   "S-BK-03"
  ],
  "corpus_doc_ids": [
   "D006",
   "D009"
  ],
  "supplementary_doc_ids": [],
  "quoted_span": "In Berkeley, tenants in units that are fully or partially covered by the Rent Ordinance cannot be evicted unless there is \"just cause” (previously called “good cause”).",
  "quoted_span_in_corpus": true,
  "quote_verified": true,
  "interaction": {
   "overrides": [
    "CA-JUST-01"
   ],
   "yields_to": [],